<?xml version="1.0" encoding="utf-8"?>

<!-- ============================================================
     An XML format file containing Routino output translations.

     Part of the Routino routing software.
     ============================================================
     This file Copyright 2010-2011 Andrew M. Bishop

     This program is free software: you can redistribute it and/or modify
     it under the terms of the GNU Affero General Public License as published by
     the Free Software Foundation, either version 3 of the License, or
     (at your option) any later version.
     ============================================================ -->

<routino-translations xmlns:xsi="http://www.w3.org/2001/XMLSchema-instance"
                      xsi:noNamespaceSchemaLocation="http://www.routino.org/xml/routino-translations.xsd">

  <!-- Original English language version by Andrew M. Bishop -->

  <language lang="en">

    <!-- Copyright of the data being routed, not of this file  -->
    <copyright>
      <creator string="Creator" text="Routino - http://www.routino.org/" />
      <source  string="Source"  text="Based on OpenStreetMap data from http://www.openstreetmap.org/" />
      <license string="License" text="http://creativecommons.org/licenses/by-sa/2.0/" />
    </copyright>

    <!-- Turn directions, 0 = ahead, -2 = left, +/-4 = behind, +2 = right -->
    <turn direction="-4" string="Very sharp left" />
    <turn direction="-3" string="Sharp left" />
    <turn direction="-2" string="Left" />
    <turn direction="-1" string="Slight left" />
    <turn direction="0"  string="Straight on" />
    <turn direction="1"  string="Slight right" />
    <turn direction="2"  string="Right" />
    <turn direction="3"  string="Sharp right" />
    <turn direction="4"  string="Very sharp right" />

    <!-- Heading directions, 0 = North, -2 = West, +/-4 = South, +2 = East -->
    <heading direction="-4" string="South" />
    <heading direction="-3" string="South-West" />
    <heading direction="-2" string="West" />
    <heading direction="-1" string="North-West" />
    <heading direction="0"  string="North" />
    <heading direction="1"  string="North-East" />
    <heading direction="2"  string="East" />
    <heading direction="3"  string="South-East" />
    <heading direction="4"  string="South" />

    <!-- Ordinals, 1 = first, 2 = second ... -->
    <ordinal number="1"  string="First" />
    <ordinal number="2"  string="Second" />
    <ordinal number="3"  string="Third" />
    <ordinal number="4"  string="Fourth" />
    <ordinal number="5"  string="Fifth" />
    <ordinal number="6"  string="Sixth" />
    <ordinal number="7"  string="Seventh" />
    <ordinal number="8"  string="Eighth" />
    <ordinal number="9"  string="Ninth" />
    <ordinal number="10" string="Tenth" />

    <!-- Highway names -->
    <highway type="motorway"     string="motorway" />
    <highway type="trunk"        string="trunk road" />
    <highway type="primary"      string="primary road" />
    <highway type="secondary"    string="secondary road" />
    <highway type="tertiary"     string="tertiary road" />
    <highway type="unclassified" string="unclassified road" />
    <highway type="residential"  string="residential road" />
    <highway type="service"      string="service road" />
    <highway type="track"        string="track" />
    <highway type="cycleway"     string="cycleway" />
    <highway type="path"         string="path" />
    <highway type="steps"        string="steps" />
    <highway type="ferry"        string="ferry" />

    <!-- The type of route -->
    <route type="shortest" string="Shortest" /> <!-- For the description and route name -->
    <route type="quickest" string="Quickest" /> <!-- For the description and route name -->

    <!-- HTML output -->
    <output-html>
      <waypoint type="waypoint"   string="Waypoint" />   <!-- For the chosen waypoints -->
      <waypoint type="junction"   string="Junction" />   <!-- For the interesting junctions -->
      <waypoint type="roundabout" string="Roundabout" /> <!-- For roundabouts -->

      <title text="%s Route" /> <!-- %s = [shortest|quickest] -->

      <start   string="Start"  text="At %s, head %s" />                  <!-- 1st %s = [waypoint|junction], 2nd %s = [heading] -->
      <node    string="At"     text="%s, go %s heading %s" />            <!-- 1st %s = [waypoint|junction], 2nd %s = [turn], 3rd %s = [heading] -->
      <rbnode  string="Leave"  text="%s, take the %s exit heading %s" /> <!-- 1st %s = [roundabout], 2nd %s = [first|second|...], 3rd %s = [heading] -->
      <segment string="Follow" text="%s for %.3f km, %.1f min" />        <!-- 1st %s = street name -->
      <stop    string="Stop"   text="At %s" />                           <!-- 1st %s = [waypoint|junction] -->
      <total   string="Total"  text="%.1f km, %.0f minutes" />
    </output-html>

    <!-- GPX output -->
    <output-gpx>
      <waypoint type="start"  string="START" /> <!-- For the first route waypoint -->
      <waypoint type="inter"  string="INTER" /> <!-- For the intermediate route waypoints -->
      <waypoint type="trip"   string="TRIP"  /> <!-- For the other route points -->
      <waypoint type="finish" string="FINISH"/> <!-- For the last route waypoint -->

      <desc  text="%s route between 'start' and 'finish' waypoints" /> <!-- %s = [shortest|quickest] -->
      <name  text="%s route" />                                        <!-- %s = [shortest|quickest] -->
      <step  text="%s on '%s' for %.3f km, %.1f min" />                <!-- 1st %s = [turn], 2nd %s = street name -->
      <final text="Total Journey %.1f km, %.0f minutes" />
    </output-gpx>

  </language>

  <!-- German translation by Christoph Eckert (July 2010) -->

  <language lang="de">

    <!-- Copyright of the data being routed, not of this file  -->
    <copyright>
      <creator string="Creator" text="Routino - http://www.routino.org/" />
      <source  string="Source"  text="Basierend auf OpenStreetMap-Daten, erhältlich via http://www.openstreetmap.org/" />
      <license string="License" text="http://creativecommons.org/licenses/by-sa/2.0/" />
    </copyright>

    <!-- Turn directions, 0 = ahead, -2 = left, +/-4 = behind, +2 = right -->
    <turn direction="-4" string="Spitzkehre nach links" />
    <turn direction="-3" string="Scharf links" />
    <turn direction="-2" string="Links" />
    <turn direction="-1" string="Halb links" />
    <turn direction="0"  string="Geradeaus" />
    <turn direction="1"  string="Halb rechts" />
    <turn direction="2"  string="Rechts" />
    <turn direction="3"  string="Scharf rechts" />
    <turn direction="4"  string="Spitzkehre nach rechts" />

    <!-- Heading directions, 0 = North, -2 = West, +/-4 = South, +2 = East -->
    <heading direction="-4" string="Süd" />
    <heading direction="-3" string="Süd-West" />
    <heading direction="-2" string="West" />
    <heading direction="-1" string="Nord-West" />
    <heading direction="0"  string="Nord" />
    <heading direction="1"  string="Nord-Ost" />
    <heading direction="2"  string="Ost" />
    <heading direction="3"  string="Süd-Ost" />
    <heading direction="4"  string="Süd" />

    <!-- Ordinals, 1 = first, 2 = second ... -->
    <!-- TRANSLATION REQUIRED: ordinal number="1"  string="First" / -->
    <!-- TRANSLATION REQUIRED: ordinal number="2"  string="Second" / -->
    <!-- TRANSLATION REQUIRED: ordinal number="3"  string="Third" / -->
    <!-- TRANSLATION REQUIRED: ordinal number="4"  string="Fourth" / -->
    <!-- TRANSLATION REQUIRED: ordinal number="5"  string="Fifth" / -->
    <!-- TRANSLATION REQUIRED: ordinal number="6"  string="Sixth" / -->
    <!-- TRANSLATION REQUIRED: ordinal number="7"  string="Seventh" / -->
    <!-- TRANSLATION REQUIRED: ordinal number="8"  string="Eighth" / -->
    <!-- TRANSLATION REQUIRED: ordinal number="9"  string="Ninth" / -->
    <!-- TRANSLATION REQUIRED: ordinal number="10" string="Tenth" / -->

    <!-- Highway names -->
    <highway type="motorway"     string="Autobahn" />
    <highway type="trunk"        string="Schnellstraße" />
    <highway type="primary"      string="Bundesstraße" />
    <highway type="secondary"    string="Landstraße" />
    <highway type="tertiary"     string="Kreisstraße" />
    <highway type="unclassified" string="Nebenstraße" />
    <highway type="residential"  string="Wohngebietsstraße" />
    <highway type="service"      string="Erschließungsweg" />
    <highway type="track"        string="Wirtschaftsweg" />
    <highway type="cycleway"     string="Radweg" />
    <highway type="path"         string="Weg" />
    <highway type="steps"        string="Treppe" />
    <highway type="ferry"        string="ferry" /> <!-- FIXME - needs translation -->

    <!-- The type of route -->
    <route type="shortest" string="Kürzeste" />   <!-- For the description and route name -->
    <route type="quickest" string="Schnellste" /> <!-- For the description and route name -->

    <!-- HTML output -->
    <output-html>
      <waypoint type="waypoint"  string="Wegpunkt" />        <!-- For the chosen waypoints -->
      <waypoint type="junction"  string="Anschlussstelle" /> <!-- For the interesting junctions -->
      <!-- TRANSLATION REQUIRED: waypoint type="roundabout" string="Roundabout" / --> <!-- For roundabouts -->

      <title text="%s Route" /> <!-- %s = [shortest|quickest] -->

      <start   string="Start"  text="Bei %s halten Sie sich Richtung %s" />          <!-- 1st %s = [waypoint|junction], 2nd %s = [heading] -->
      <node    string="Bei"    text="Bei %s wenden Sie sich nach %s Richtung %s" />  <!-- 1st %s = [waypoint|junction], 2nd %s = [turn], 3rd %s = [heading] -->
      <!-- TRANSLATION REQUIRED: rbnode  string="Leave"  text="%s, take the %s exit heading %s" / --> <!-- 1st %s = [roundabout], 2nd %s = [first|second|...], 3rd %s = [heading] -->